{"fidelity":{"bound":null,"contract_id":"3232323232323232323232323232323232323232323232323232323232323232","kind":"exact","metric":null},"implementation":{"build_id":"fixture-lml-build-v1","implementation_id":"3131313131313131313131313131313131313131313131313131313131313131","kernel_id":"fixture-lml-portable-kernel-v1"},"model_provenance":null,"packets":[{"content_id":"00801863e741a15fd003fd88b3074e8710c4d9efe5d875e23ebba7c029467323","logical_bytes":18,"ordinal":0},{"content_id":"6a80a7e930190e1c751024c9239265d811c631f450ac66497d08e703b80c19af","logical_bytes":20,"ordinal":1}],"parameters":[{"name":"predictor.order","value":{"type":"integer","value":"8"}}],"profile":"lml-lossless","schema":"org.quitetall.abir.bcs2.codec-bundle-v1","semantics_frame":{"content_id":"51d4391d78ff85156bd0de05a16370e8dbfaa248bbcddfe6f545a76d26c5a658","logical_bytes":1419},"source_interchange_id":"35955e5a39ddeed771be1757a1bb79f345d6ea1c0311f742e93e1bf5200974d5","source_semantic_id":"6f8244472204b5ed25ebd67a1abd88e24f2addd6b152bb1857b27b78e7d02ebe"}