{"fidelity":{"bound":{"denominator":"1000","numerator":"75","type":"rational"},"contract_id":"4242424242424242424242424242424242424242424242424242424242424242","kind":"bounded","metric":"prd"},"implementation":{"build_id":"fixture-lmq-build-v1","implementation_id":"4141414141414141414141414141414141414141414141414141414141414141","kernel_id":"fixture-lmq-reference-kernel-v1"},"model_provenance":{"checkpoint_content_id":"4343434343434343434343434343434343434343434343434343434343434343","checkpoint_sha256":"4444444444444444444444444444444444444444444444444444444444444444","pccp_change_id":"fixture-candidate-not-promoted","pccp_evidence_id":"4545454545454545454545454545454545454545454545454545454545454545","pccp_status":"candidate"},"packets":[{"content_id":"da3bafff7a74a12153e3898bc492a3e511ecdffece5ad05b938976799d3fc7d8","logical_bytes":15,"ordinal":0},{"content_id":"1a4ad98b7f53661d3698dc2acc11067afafe7888053c166e1d3486fa181faa25","logical_bytes":22,"ordinal":1}],"parameters":[{"name":"fsq.level","value":{"type":"integer","value":"8"}},{"name":"temporal.tokens","value":{"type":"integer","value":"79"}}],"profile":"lmq-progressive","schema":"org.quitetall.abir.bcs2.codec-bundle-v1","semantics_frame":{"content_id":"51d4391d78ff85156bd0de05a16370e8dbfaa248bbcddfe6f545a76d26c5a658","logical_bytes":1419},"source_interchange_id":"35955e5a39ddeed771be1757a1bb79f345d6ea1c0311f742e93e1bf5200974d5","source_semantic_id":"6f8244472204b5ed25ebd67a1abd88e24f2addd6b152bb1857b27b78e7d02ebe"}